{
  "data path": {
    "data_path": "/Users/rainy/code/deep-learning/Data/crack500",
    "category_list": ["train", "test", "validation"],
    "img_dir_list": ["image", "groundtruth", "mask"]
  },
  "data attributes": {
    "batch_height": 256,
    "batch_width": 256
  },
  "train settings": {
    "batch_size": 4,
    "N_epochs": 100,
    "train_split": 1500,
    "criterion": "BCELoss",
    "optimizer": {
      "name": "SGD",
      "lr": 1e-3,
      "momentum": 0.9,
      "weight_decay": 1e-4,
      "nesterov": false
    },
    "scheduler": {
      "name": "CosineAnnealingLR",
      "T_max": 100,
      "eta_min": 1e-5
    },
    "early_stopping_patience": -1
  },
  "test settings": {
    "best_last": "best",
    "batch_size": 20,
    "metrics_mode": "gpu"
  },
  "result settings": {
    "folder_list": ["code", "config", "figure", "log", "model"]
  }
}
